{
  "$schema": "https://json-schema.org/draft/2020-12/schema",
  "$id": "https://github.com/Raybbish/skill-store/packages/schemas/skill-report.schema.json",
  "title": "SkillReport",
  "description": "Skill Store catalog entry. v2(ADR 0012):security_audit 拆出至 catalog/verdicts 账本(scan-verdict@v1,见 packages/verdicts)。One file per skill under catalog/skills/<owner>/<repo>/<name>/skill-report.json",
  "type": "object",
  "required": ["schema_version", "meta"],
  "properties": {
    "schema_version": { "enum": ["1", "2"] },
    "meta": {
      "type": "object",
      "required": ["id", "name", "upstream", "upstream_commit", "content_hash", "license", "hosting"],
      "properties": {
        "id": { "type": "string", "pattern": "^[a-z0-9-]+/[a-z0-9._-]+/[a-z0-9._-]+$", "description": "规范 ID:owner/repo/name(owner、repo 小写;消除同 owner 跨仓同名 skill 撞 id)" },
        "name": { "type": "string", "maxLength": 64 },
        "description": { "type": "string", "maxLength": 1024 },
        "upstream": { "type": "string", "description": "上游仓库内路径 URL" },
        "upstream_commit": { "type": "string", "description": "采集时上游 HEAD commit,每日 diff 锚点" },
        "content_hash": { "type": "string", "pattern": "^sha256:[a-f0-9]{64}$", "description": "对 skill 目录内 (path, git blob sha) 排序集合的 sha256;CLI 安装时校验" },
        "license": { "type": "string", "description": "SPDX id 或 local-file(needs-review) / none(all-rights-reserved)" },
        "hosting": { "enum": ["mirrored", "indexed"], "description": "宽松 licence 镜像托管;否则仅索引跳转上游" },
        "mirror_complete": { "type": "boolean", "description": "mirrored 时:mirror/ 是否含全部文件(M0 仅镜像 SKILL.md 时为 false)" },
        "category": { "type": ["string", "null"], "description": "主分类:featured 标签 slug(见 packages/schemas/src/labels.ts);未达标为 \"uncategorized\" 或 null" },
        "tags": { "type": "array", "items": { "type": "string" }, "description": "标签:featured:false 标签 slug 列表(桶内二级筛选;与 category 同一套词表)" },
        "category_locked": { "type": "boolean", "description": "人工锁定分类:true 时 ingest 不再用启发式覆盖 category/tags" },
        "version": { "type": ["string", "null"], "description": "frontmatter 声明的版本(如有)" },
        "publisher": { "type": "string" },
        "publisher_verified": { "type": "boolean", "default": false },
        "duplicate_of": { "type": ["string", "null"], "description": "content_hash 相同的既有条目 id" }
      }
    },
    "frontmatter_valid": { "type": "boolean", "description": "是否通过 agentskills.io 最小规范校验(name+description)" },
    "frontmatter_issues": { "type": "array", "items": { "type": "string" } },
    "signals": {
      "type": "object",
      "properties": {
        "stars_github": { "type": ["integer", "null"] },
        "installs_skills_sh": { "type": ["integer", "null"] },
        "curated_by": {
          "type": "array",
          "description": "被哪些社区精选清单收录(Hub 精选信号)",
          "items": {
            "type": "object",
            "properties": { "list": { "type": "string" }, "category": { "type": "string" } }
          }
        },
        "repo_skill_count": { "type": "integer", "description": "采集时上游仓库内 SKILL.md 总数(巨仓降权信号)" },
        "bulk_source": { "type": "boolean", "description": "上游仓库 skill 数超过每仓上限(MAX_PER_REPO),本条目来自折叠采样收录" },
        "fetched_at": { "type": "string", "format": "date-time" }
      }
    },
    "token_cost": {
      "type": "object",
      "properties": {
        "body_tokens": { "type": "integer", "description": "SKILL.md 正文 token 估算(chars/4)" },
        "method": { "type": "string" }
      }
    },
    "eval": { "type": ["object", "null"], "description": "M1 基准评测结果(category/runner/model/score/lift_pp/evaluable_tasks/total_tasks/tasks);未评测为 null。产物缺失记 N/A(不计 0 分);仅带模型元数据且无 N/A 任务的真实结果才回写(见 pipeline jobs/eval.ts 写入闸)" }
  }
}
