{
  "schema_version": "2",
  "meta": {
    "id": "runcomfy-com/skills/image-inpainting",
    "name": "image-inpainting",
    "description": "Mask-driven image inpainting on RunComfy via the `runcomfy` CLI. Routes to Tongyi MAI Z-Image Turbo Inpainting (the dedicated inpainting endpoint with mask, strength, and control-scale) and to identity-preserving edit models (Nano Banana 2 Edit, GPT Image 2 Edit, FLUX Kontext Pro) when a mask isn't available and the region must be described instead. Use for object removal, watermark removal, region replacement, blemish cleanup, and any controlled local edit where a binary mask defines the target area. Triggers on \"inpaint\", \"inpainting\", \"image inpaint\", \"remove from image\", \"fill region\", \"mask-driven edit\", \"remove watermark\", \"remove object\", \"patch the photo\", \"fill the hole\", or any explicit ask to edit a specific masked region of a still.\n",
    "upstream": "https://github.com/runcomfy-com/skills/tree/main/image-inpainting",
    "upstream_commit": "fca19ae084c2ae4667f5c8affbb99da5103d5832",
    "content_hash": "sha256:564a340fe0beb7868b59e414d159d1bc3209158d41f95d5532a5dc15860d4ca1",
    "license": "MIT",
    "hosting": "indexed",
    "category": "media",
    "version": null,
    "publisher": "runcomfy-com",
    "publisher_verified": false,
    "duplicate_of": "agentspace-so/runcomfy-agent-skills/image-inpainting",
    "tags": [
      "refactoring",
      "api",
      "cli"
    ]
  },
  "frontmatter_valid": true,
  "frontmatter_issues": [],
  "signals": {
    "stars_github": null,
    "installs_skills_sh": 240100,
    "fetched_at": "2026-07-05T06:39:37.096Z"
  },
  "token_cost": {
    "body_tokens": 2853,
    "method": "chars/4-estimate"
  },
  "eval": null
}
