{
  "schema_version": "2",
  "meta": {
    "id": "a5c-ai/babysitter/convoy-management",
    "name": "convoy-management",
    "description": "Create, track, and land convoys of related beads as primary work orders in the Gas Town multi-agent orchestration framework.",
    "upstream": "https://github.com/a5c-ai/babysitter/tree/main/library/methodologies/gastown/skills/convoy-management",
    "upstream_commit": "44a5d58b47b93962f143914e0652d9e3ae5dcf2c",
    "content_hash": "sha256:c64d606feb075253464cb409c79789af0c8893631c18884bcf2492f64619ae0c",
    "license": "MIT",
    "hosting": "mirrored",
    "mirror_complete": true,
    "category": "dev",
    "version": null,
    "publisher": "a5c-ai",
    "publisher_verified": false,
    "duplicate_of": null,
    "tags": [
      "agent-ops"
    ]
  },
  "frontmatter_valid": true,
  "frontmatter_issues": [],
  "signals": {
    "stars_github": 1468,
    "installs_skills_sh": null,
    "fetched_at": "2026-07-03T13:33:46.319Z",
    "repo_skill_count": 2112,
    "bulk_source": true
  },
  "token_cost": {
    "body_tokens": 377,
    "method": "chars/4-estimate"
  },
  "eval": null
}
